<?xml version="1.0" encoding="UTF-8"?>
<!--
To change this license header, choose License Headers in Project Properties.
To change this template file, choose Tools | Templates
and open the template in the editor.
-->


<ZanalCar
    xmlns:xsi='http://www.w3.org/2001/XMLSchema-instance'
    xsi:noNamespaceSchemaLocation='file:/home/daw/NetBeansProjects/segundotrimestre/XML/public_html/XML/ZanalCar/newXmlSchemaZanalCar.xsd'>
    <Vehiculos>
        <Coche>
            <Color></Color>
            <Marca></Marca>
            <PrecioCompra>5</PrecioCompra>
            <PrecioVenta>6</PrecioVenta>
            <Matricula></Matricula>
            <KilometrosUso>3</KilometrosUso>
        </Coche>
        <Moto>
            <Color></Color>
            <Marca></Marca>
            <PrecioCompra>6</PrecioCompra>
            <PrecioVenta>6</PrecioVenta>
            <Matricula></Matricula>
            <KilometrosUso>6</KilometrosUso>
        </Moto>
        
        <Bici>
            <Color></Color>
            <Marca></Marca>
            <PrecioCompra>6</PrecioCompra>
            <PrecioVenta>6</PrecioVenta>
            <TamañoRueda>6</TamañoRueda>
            <NumeroCambios>6</NumeroCambios>
        </Bici>
        <Quad>
            <Color></Color>
            <Marca></Marca>
            <PrecioCompra>6</PrecioCompra>
            <PrecioVenta>6</PrecioVenta>
            <Matricula></Matricula>
            <KilometrosUso>6</KilometrosUso>
        </Quad>
    </Vehiculos>

</ZanalCar>
